tweet_id,jpg_url,Dog_breed,timestamp,source,text,rating_numerator,rating_denominator,name,stage
6.782554641828618e+17,https://pbs.twimg.com/media/CWmlvxJU4AEAqaN.jpg,Chihuahua,2015-12-19 16:47:58+00:00,Twitter for iPhone,This is Jessifer. She is a Bismoth Teriyaki. Flowers being attacked by hurricanes on bandana (rad). 9/10 stellar pup,9,10,Jessifer,
678023323247357953,None,None,2015-12-19 01:25:31+00:00,Twitter for iPhone,After getting lost in Reese's eyes for several minutes we're going to upgrade him to a 13/10,13,10,None,
6.780211157180293e+17,https://pbs.twimg.com/media/CWjQm5gXAAA9GkD.jpg,miniature pinscher,2015-12-19 01:16:45+00:00,Twitter for iPhone,This is Reese. He likes holding hands. 12/10,12,10,Reese,
677961670166224897,None,None,2015-12-18 21:20:32+00:00,Vine - Make a Scene,This is Izzy. She's showing off the dance moves she's been working on. 11/10 I guess hard work pays off,11,10,Izzy,
6.779185315147039e+17,https://pbs.twimg.com/media/CWhzTbzWUAAEAUN.jpg,Eskimo dog,2015-12-18 18:29:07+00:00,Twitter for iPhone,"""Everything looks pretty good in there. Make sure to brush your gums. Been flossing? How's school going?"" Both 10/10",10,10,None,
6.778951012182016e+17,https://pbs.twimg.com/media/CWhd_7WWsAAaqWG.jpg,dalmatian,2015-12-18 16:56:01+00:00,Twitter for iPhone,Guys this was terrifying. Really spooked me up. We don't rate ghosts. We rate dogs. Please only send dogs... 9/10,9,10,None,
677716515794329600,None,None,2015-12-18 05:06:23+00:00,Twitter for iPhone,IT'S PUPPERGEDDON. Total of 144/120 ...I think,10,10,None,
6.777000033270292e+17,https://pbs.twimg.com/media/CWesj06W4AAIKl8.jpg,Siberian husky,2015-12-18 04:00:46+00:00,Twitter for iPhone,This is Ralph. He's an interpretive dancer. 10/10,10,10,Ralph,
6.776984035481928e+17,https://pbs.twimg.com/media/CWerGmOXAAAm6NY.jpg,Shih-Tzu,2015-12-18 03:54:25+00:00,Twitter for iPhone,This is Sadie. She got her holidays confused. 9/10 damn it Sadie,9,10,Sadie,
6.77687604918272e+17,https://pbs.twimg.com/media/CWehRdEWIAAySyO.jpg,Pembroke,2015-12-18 03:11:30+00:00,Twitter for iPhone,This was Cindy's face when she heard Susan forgot the snacks for after the kid's soccer game. 11/10,11,10,None,
6.77673981332312e+17,https://pbs.twimg.com/media/CWeU5LBWEAA8F0J.jpg,Maltese dog,2015-12-18 02:17:22+00:00,Twitter for iPhone,Endangered triangular pup here. Could be a wizard. Caught mid-laugh. No legs. Just fluff. Probably a wizard. 9/10,9,10,None,
677662372920729601,None,None,2015-12-18 01:31:14+00:00,Twitter for iPhone,"In honor of the new Star Wars movie. Here's Yoda pug. 12/10 pet really well, would I",12,10,None,
6.776440919293297e+17,https://pbs.twimg.com/ext_tw_video_thumb/677644010865999872/pu/img/zVHEMYnJKzq1SauT.jpg,Chihuahua,2015-12-18 00:18:36+00:00,Twitter for iPhone,This is a dog swinging. I really enjoyed it so I hope you all do as well. 11/10,11,10,a,
677573743309385728,None,None,2015-12-17 19:39:03+00:00,Twitter for iPhone,This is Sandy. He's sexually confused. Thinks he's a pigeon. Also an All-American cheese catcher. 10/10 so petable,10,10,Sandy,
6.775657153276887e+17,https://pbs.twimg.com/media/CWcybBmWcAAigAQ.jpg,basset,2015-12-17 19:07:09+00:00,Twitter for iPhone,Contortionist pup here. Inside pentagram. Clearly worships Satan. Known to slowly push fragile stuff off tables 6/10,6,10,None,
677557565589463040,None,None,2015-12-17 18:34:46+00:00,Twitter for iPhone,Reckless pupper here. Not even looking at road. Absolute menace. No regard for fellow pupper lives. 10/10 still cute,10,10,None,pupper
6.775479285049672e+17,https://pbs.twimg.com/media/CWciPonWEAUOqLD.jpg,American Staffordshire terrier,2015-12-17 17:56:29+00:00,Twitter for iPhone,Not much to say here. I just think everyone needs to see this. 12/10,12,10,None,
6.775300728872059e+17,https://pbs.twimg.com/media/CWcSAI-WUAAOB9W.jpg,Staffordshire bullterrier,2015-12-17 16:45:31+00:00,Twitter for iPhone,Say hello to Axel. He's a Black Chevy Pinot on wheels. 0 to 60 in 5.7 seconds (if downhill). 9/10 I call shotgun,9,10,Axel,
677335745548390400,None,None,2015-12-17 03:53:20+00:00,Vine - Make a Scene,Downright inspiring 12/10,12,10,None,
6.773346151667302e+17,https://pbs.twimg.com/media/CWZgPPUWUAAUOvu.jpg,Lakeland terrier,2015-12-17 03:48:51+00:00,Twitter for iPhone,This dog gave up mid jump. 9/10,9,10,None,
6.77331501395157e+17,https://pbs.twimg.com/media/CWZdaGxXAAAjGjb.jpg,beagle,2015-12-17 03:36:28+00:00,Twitter for iPhone,Meet Humphrey. He's a Northern Polyp Viagra. One ear works. Face stuck like that. Always surprised. 9/10 petable af,9,10,Humphrey,
677328882937298944,None,None,2015-12-17 03:26:04+00:00,Twitter for iPhone,This is Derek. All the dogs adore Derek. He's a great guy. 10/10 really solid pup,10,10,Derek,
6.773148121253233e+17,https://pbs.twimg.com/media/CWZOOIUW4AAQrX_.jpg,Blenheim spaniel,2015-12-17 02:30:09+00:00,Twitter for iPhone,"Meet Tassy & Bee. Tassy is pretty chill, but Bee is convinced the Ruffles are haunted. 10/10 & 11/10 respectively",10,10,Tassy,
6.773010331697889e+17,https://pbs.twimg.com/media/CWZBsjPWsAAZFFl.jpg,Japanese spaniel,2015-12-17 01:35:24+00:00,Twitter for iPhone,This is Juckson. He's totally on his way to a nascar race. 5/10 for Juckson,5,10,Juckson,
6.77269281705472e+17,https://pbs.twimg.com/media/CWYk0WxWoAAEwRt.jpg,Shetland sheepdog,2015-12-16 23:29:14+00:00,Twitter for iPhone,This is the happiest pupper I've ever seen. 10/10 would trade lives with,10,10,the,pupper
677228873407442944,None,None,2015-12-16 20:48:40+00:00,Twitter for iPhone,Say hello to Chuq. He just wants to fit in. 11/10,11,10,Chuq,
6.771873001876111e+17,https://pbs.twimg.com/media/CWXaQMBWcAAATDi.jpg,English setter,2015-12-16 18:03:28+00:00,Twitter for iPhone,Here we see a Byzantine Rigatoni. Very aerodynamic. No eyes. Actually not windy here they just look like that. 9/10,9,10,None,
6.769755325804093e+17,https://pbs.twimg.com/media/CWUZpydWcAAeipD.jpg,malamute,2015-12-16 04:01:59+00:00,Twitter for iPhone,This is Cooper. He doesn't know how cheese works. Likes the way it feels on his face. Cheeky tongue slip. 11/10,11,10,Cooper,
6.769578600860959e+17,https://pbs.twimg.com/ext_tw_video_thumb/676957802976419840/pu/img/dCj-qlXo73A5hf6Q.jpg,Labrador retriever,2015-12-16 02:51:45+00:00,Twitter for iPhone,10/10 I'd follow this dog into battle no questions asked,10,10,None,
6.769496327742341e+17,https://pbs.twimg.com/media/CWUCGMtWEAAjXnS.jpg,Welsh springer spaniel,2015-12-16 02:19:04+00:00,Twitter for iPhone,This is Tyrus. He's a Speckled Centennial Ticonderoga. Terrified of floating red ball. Nifty bandana. 8/10 v petable,8,10,Tyrus,
676948236477857792,None,None,2015-12-16 02:13:31+00:00,Twitter for iPhone,This is Karl. Karl thinks he's slick. 6/10 sneaky pup,6,10,Karl,
6.769468644790845e+17,https://pbs.twimg.com/media/CWT_lOQWUAAXPaY.jpg,Pekinese,2015-12-16 02:08:04+00:00,Twitter for iPhone,This pups goal was to get all four feet as close to each other as possible. Valiant effort 12/10,12,10,None,
676942428000112642,None,None,2015-12-16 01:50:26+00:00,Twitter for iPhone,Who leaves the last cupcake just sitting there? 9/10,9,10,None,
6.769365419361853e+17,https://pbs.twimg.com/media/CWT2MUgWIAECWig.jpg,Chesapeake Bay retriever,2015-12-16 01:27:03+00:00,Twitter for iPhone,Here we see a rare pouched pupper. Ample storage space. Looks alert. Jumps at random. Kicked open that door. 8/10,8,10,None,pupper
676916996760600576,None,None,2015-12-16 00:09:23+00:00,Vine - Make a Scene,Super speedy pupper. Does not go gentle into that goodnight. 10/10,10,10,None,pupper
676897532954456065,None,None,2015-12-15 22:52:02+00:00,Twitter for iPhone,Exotic handheld dog here. Appears unathletic. Feet look deadly. Can be thrown a great distance. 5/10 might pet idk,5,10,None,
6.768645016150426e+17,https://pbs.twimg.com/media/CWS0q8iU8AE2Srr.jpg,Chesapeake Bay retriever,2015-12-15 20:40:47+00:00,Twitter for iPhone,Meet Ash. He's just a head now. Lost his body during the Third Crusade. Still in good spirits. 10/10 would pet well,10,10,Ash,
6.768219580430336e+17,https://pbs.twimg.com/media/CWSN-vaXAAA8Ehr.jpg,Great Pyrenees,2015-12-15 17:51:44+00:00,Twitter for iPhone,Finally some constructive political change in this country. 11/10,11,10,None,
676819651066732545,None,None,2015-12-15 17:42:34+00:00,Twitter for iPhone,Watch out Airbud. This pupper is also good at the sports. 12/10 I'm thinking D1,12,10,None,pupper
6.768117467079188e+17,https://pbs.twimg.com/media/CWSEsO9WwAAX-fZ.jpg,Chihuahua,2015-12-15 17:11:09+00:00,Twitter for iPhone,Say hello to Penny & Gizmo. They are practicing their caroling. The ambition in the room is tangible. 9/10 for both,9,10,Penny,
676776431406465024,None,None,2015-12-15 14:50:49+00:00,Twitter for iPhone,"When someone yells ""cops!"" at a party and you gotta get your drunk friend out of there. 10/10",10,10,None,
6.766175037626819e+17,https://pbs.twimg.com/media/CWPUB9TWwAALPPx.jpg,Chihuahua,2015-12-15 04:19:18+00:00,Twitter for iPhone,I promise this wasn't meant to be a cuteness overload account but ermergerd look at this cozy pupper. 13/10,13,10,None,pupper
676613908052996102,None,None,2015-12-15 04:05:01+00:00,Twitter for iPhone,This is the saddest/sweetest/best picture I've been sent. 12/10 ðŸ˜¢ðŸ¶,12,10,the,
676606785097199616,None,None,2015-12-15 03:36:42+00:00,Twitter for iPhone,*screeches for a sec and then faints* 12/10,12,10,None,
6.766033933145784e+17,https://pbs.twimg.com/media/CWPHMqKVAAAE78E.jpg,whippet,2015-12-15 03:23:14+00:00,Twitter for iPhone,This is Godzilla pupper. He had a ruff childhood & now deflects that pain outward by terrorizing cities. Tragic 9/10,9,10,Godzilla,pupper
676593408224403456,None,None,2015-12-15 02:43:33+00:00,Vine - Make a Scene,This pupper loves leaves. 11/10 for committed leaf lover,11,10,None,pupper
676590572941893632,None,None,2015-12-15 02:32:17+00:00,Twitter for iPhone,After some outrage from the crowd. Bubbles is being upgraded to a 7/10. That's as high as I'm going. Thank you,7,10,None,
6.765883460978524e+17,https://pbs.twimg.com/media/CWO5gmCUYAAX4WA.jpg,Boston bull,2015-12-15 02:23:26+00:00,Twitter for iPhone,This is Bubbles. He kinda resembles a fish. Always makes eye contact with u no matter what. Sneaky tongue slip. 5/10,5,10,Bubbles,
676582956622721024,None,None,2015-12-15 02:02:01+00:00,Twitter for iPhone,"Meet Vinnie. He's having fun while being safe. Well not a lot of fun, but definitely safe, and that's important 8/10",8,10,Vinnie,
676575501977128964,None,None,2015-12-15 01:32:24+00:00,Twitter for iPhone,This pupper is very passionate about Christmas. Wanted to give the tree a hug. So cute. 8/10,8,10,None,pupper
6.765337988766515e+17,https://pbs.twimg.com/media/CWOH4s9U8AEtkmQ.jpg,chow,2015-12-14 22:46:41+00:00,Twitter for iPhone,ITSOFLUFFAYYYYY 12/10,12,10,None,
6.764963751949804e+17,https://pbs.twimg.com/media/CWNl3S9WcAARN34.jpg,pug,2015-12-14 20:17:59+00:00,Twitter for iPhone,Say hello to Griffin. He's upset because his costume for Halloween didn't arrive until today. 9/10 cheer up pup,9,10,Griffin,
6.764706390841016e+17,https://pbs.twimg.com/media/CWNOdIpWoAAWid2.jpg,golden retriever,2015-12-14 18:35:43+00:00,Twitter for iPhone,Three generations of pupper. 11/10 for all,11,10,None,pupper
6.764400075702477e+17,https://pbs.twimg.com/media/CWMyl9EWUAAnZJ0.jpg,Maltese dog,2015-12-14 16:34:00+00:00,Twitter for iPhone,Hope your Monday isn't too awful. Here's two baseball puppers. 11/10 for each,11,10,None,
6.764309333822956e+17,https://pbs.twimg.com/media/CWMqV7WUYAEEClG.jpg,golden retriever,2015-12-14 15:57:56+00:00,Twitter for iPhone,"Meet Duke. He's an Urban Parmesan. They know he's scared of the green rubber dog. ""Why u do dis?"" thinks Duke. 10/10",10,10,Duke,
676263575653122048,None,None,2015-12-14 04:52:55+00:00,Twitter for iPhone,All this pupper wanted to do was go skiing. No one told him about the El NiÃ±o. Poor pupper. 10/10 maybe next year,10,10,None,pupper
6.762373653929083e+17,https://pbs.twimg.com/media/CWJ6Sc-WwAAlpI6.jpg,French bulldog,2015-12-14 03:08:46+00:00,Twitter for iPhone,Say hello to Winston. He has no respect for the system. Much rebellion. I think that's a palm tree... nice. 8/10,8,10,Winston,
676219687039057920,None,None,2015-12-14 01:58:31+00:00,Twitter for iPhone,This is Kenneth. He's stuck in a bubble. 10/10 hang in there Kenneth,10,10,Kenneth,
676215927814406144,None,None,2015-12-14 01:43:35+00:00,Twitter for iPhone,This is Herm. He just wants to be like the other dogs. Sneaky tongue slip. Super fuzzy. 9/10 would cuddle firmly,9,10,Herm,
6.761918324858102e+17,https://pbs.twimg.com/media/CWJQ4UmWoAIJ29t.jpg,Chihuahua,2015-12-14 00:07:50+00:00,Twitter for iPhone,These two pups just met and have instantly bonded. Spectacular scene. Mesmerizing af. 10/10 and 7/10 for blue dog,10,10,None,
6.761463419664384e+17,https://pbs.twimg.com/media/CWIngp5WEAAJOy3.jpg,Irish water spaniel,2015-12-13 21:07:04+00:00,Twitter for iPhone,This is Bert. He likes flowers. 10/10,10,10,Bert,
676121918416756736,None,None,2015-12-13 19:30:01+00:00,Vine - Make a Scene,Here we are witnessing a very excited dog. Clearly has no control over neck movements. 8/10 would still pet,8,10,None,
6.761019188134994e+17,https://pbs.twimg.com/media/CWH_FTgWIAAwOUy.jpg,Shih-Tzu,2015-12-13 18:10:33+00:00,Twitter for iPhone,Meet Striker. He's ready for Christmas. 11/10,11,10,Striker,
676098748976615425,None,None,2015-12-13 17:57:57+00:00,Twitter for iPhone,Extremely rare pup here. Very religious. Always praying. Too many legs. Not overwhelmingly fluffy. Won't bark. 3/10,3,10,None,
6.760894839185162e+17,https://pbs.twimg.com/media/CWHzzFGXIAA0Y_H.jpg,bull mastiff,2015-12-13 17:21:08+00:00,Twitter for iPhone,"""Yes hello I'ma just snag this here toasted bagel real quick. carry on."" 9/10",9,10,None,
6.758981307354767e+17,https://pbs.twimg.com/media/CWFFt3_XIAArIYK.jpg,Labrador retriever,2015-12-13 04:40:46+00:00,Twitter for iPhone,I'm sure you've all seen this pupper. Not prepared at all for the flying disc of terror. 10/10,10,10,None,pupper
6.758915557696963e+17,https://pbs.twimg.com/media/CWE_x33UwAEE3no.jpg,Italian greyhound,2015-12-13 04:14:39+00:00,Twitter for iPhone,This is Donny. He's summoning the demon monster Babadook. 6/10 Donny please no that won't be a good time for anyone,6,10,Donny,
6.75888385639252e+17,https://pbs.twimg.com/media/CWE85snWIAEG5ES.jpg,West Highland white terrier,2015-12-13 04:02:03+00:00,Twitter for iPhone,Breathtaking scene. A father taking care of his newborn pup. Tugs at the heartstrings. 10/10 restores my faith,10,10,None,
675878199931371520,None,None,2015-12-13 03:21:34+00:00,Twitter for iPhone,"Ok, I'll admit this is a pretty adorable bunny hopping towards the ocean but please only send in dogs... 11/10",11,10,None,
6.758707210636698e+17,https://pbs.twimg.com/media/CWEs1b-WEAEhq82.jpg,golden retriever,2015-12-13 02:51:51+00:00,Twitter for iPhone,& this is Yoshi. Another world record contender 11/10 (what the hell is happening why are there so many contenders?),11,10,None,
6.75853064436392e+17,https://pbs.twimg.com/media/CWEcxqWVEAAHyGH.jpg,Labrador retriever,2015-12-13 01:41:41+00:00,Twitter for iPhone,Here we have an entire platoon of puppers. Total score: 88/80 would pet all at once,10,10,None,
675849018447167488,None,None,2015-12-13 01:25:37+00:00,Twitter for iPhone,This dog is being demoted to a 9/10 for not wearing a helmet while riding. Gotta stay safe out there. Thank you,9,10,None,
6.758456573542154e+17,https://pbs.twimg.com/media/CWEWClfW4AAnqhG.jpg,pug,2015-12-13 01:12:15+00:00,Twitter for iPhone,"This is Pepper. She's not fully comfortable riding her imaginary bike yet. 10/10 don't worry pupper, it gets easier",10,10,Pepper,pupper
6.75822767435051e+17,https://pbs.twimg.com/media/CWEBOFYWwAA-O2c.jpg,Pomeranian,2015-12-12 23:41:18+00:00,Twitter for iPhone,ðŸŽ¶ HELLO FROM THE OTHER SIIIIIIIIDE ðŸŽ¶ 10/10s,10,10,None,
6.758209296672195e+17,https://pbs.twimg.com/media/CWD_jQMWEAAdYwH.jpg,basset,2015-12-12 23:34:00+00:00,Twitter for iPhone,Here's a handful of sleepy puppers. All look unaware of their surroundings. Lousy guard dogs. Still cute tho 11/10s,11,10,None,
6.757984427031224e+17,https://pbs.twimg.com/media/CWDrGH4UYAARoq_.jpg,beagle,2015-12-12 22:04:39+00:00,Twitter for iPhone,This is Bernie. He just touched a boob for the first time. 10/10,10,10,Bernie,
6.757815629658685e+17,https://pbs.twimg.com/media/CWDbv2yU4AARfeH.jpg,Maltese dog,2015-12-12 20:57:34+00:00,Twitter for iPhone,Say hello to Buddah. He was Waldo for Halloween. 11/10,11,10,Buddah,
6.757403607531602e+17,https://pbs.twimg.com/ext_tw_video_thumb/675740268751138818/pu/img/dVaVeFAVT-lk_1ZV.jpg,golden retriever,2015-12-12 18:13:51+00:00,Twitter for iPhone,Here's a pupper licking in slow motion. 12/10 please enjoy,12,10,None,pupper
6.757108909567508e+17,https://pbs.twimg.com/media/CWCbd8ZWoAAtqoH.jpg,standard schnauzer,2015-12-12 16:16:45+00:00,Twitter for iPhone,This is Lenny. He was just told that he couldn't explore the fish tank. 12/10 smh all that work for nothing,12,10,Lenny,
675707330206547968,None,None,2015-12-12 16:02:36+00:00,Twitter for iPhone,We've got ourselves a battle here. Watch out Reggie. 11/10,11,10,None,
6.75706639471788e+17,https://pbs.twimg.com/media/CWCXj35VEAIFvtk.jpg,English springer,2015-12-12 15:59:51+00:00,Twitter for iPhone,This is a Sizzlin Menorah spaniel from Brooklyn named Wylie. Lovable eyes. Chiller as hell. 10/10 and I'm out.. poof,10,10,a,
6.755344944394895e+17,https://pbs.twimg.com/media/CV_7CV6XIAEV05u.jpg,chow,2015-12-12 04:35:48+00:00,Twitter for iPhone,Seriously guys?! Only send in dogs. I only rate dogs. This is a baby black bear... 11/10,11,10,a,
6.755314759457096e+17,https://pbs.twimg.com/media/CV_4ShmUYAA3wNu.jpg,Pembroke,2015-12-12 04:23:49+00:00,Twitter for iPhone,This is Ellie AKA Queen Slayer of the Orbs. Very self-motivated. Great yard. Rad foliage. 10/10 would pet diligently,10,10,Ellie,
6.755224035822182e+17,https://pbs.twimg.com/media/CV_wCh8W4AEWWZ9.jpg,cocker spaniel,2015-12-12 03:47:46+00:00,Twitter for iPhone,Meet Sammy. He's a Motorola Firefox. Hat under hoodie (must be a half-decent up and coming white rapper) 10/10,10,10,Sammy,
6.755178289094246e+17,https://pbs.twimg.com/media/CV_r3v4VAAALvwg.jpg,Scottish deerhound,2015-12-12 03:29:35+00:00,Twitter for iPhone,12/10 stay woke,12,10,None,
675501075957489664,None,None,2015-12-12 02:23:01+00:00,Twitter for iPhone,"I shall call him squishy and he shall be mine, and he shall be my squishy. 13/10",13,10,None,
6.754971033223864e+17,https://pbs.twimg.com/media/CV_ZAhcUkAUeKtZ.jpg,vizsla,2015-12-12 02:07:14+00:00,Twitter for iPhone,Meet Reggie. He's going for the world record. Must concentrate. Focus up pup. 11/10 we all believe in you Reggie,11,10,Reggie,
6.754899716172964e+17,https://pbs.twimg.com/media/CV_SimUWoAAvJSY.jpg,West Highland white terrier,2015-12-12 01:38:53+00:00,Twitter for iPhone,RT until we find this dog. Clearly a cool dog (front leg relaxed out window). Looks to be a superb driver. 10/10,10,10,None,
675483430902214656,None,None,2015-12-12 01:12:54+00:00,Twitter for iPhone,Rare shielded battle dog here. Very happy about abundance of lettuce. Painfully slow fetcher. Still petable. 5/10,5,10,None,
6.754327465174262e+17,https://pbs.twimg.com/media/CV-ef64WoAAbh0I.jpg,Labrador retriever,2015-12-11 21:51:30+00:00,Twitter for iPhone,Happy Friday. Here's some golden puppers. 12/10 for all,12,10,None,
6.753722404484547e+17,https://pbs.twimg.com/media/CV9nd30XAAAEba5.jpg,Chihuahua,2015-12-11 17:51:04+00:00,Twitter for iPhone,"The tail alone is 13/10. Great dog, better owner",13,10,None,
6.753626097392067e+17,https://pbs.twimg.com/media/CV9etctWUAAl5Hp.jpg,Labrador retriever,2015-12-11 17:12:48+00:00,Twitter for iPhone,This is Daisy. She loves that shoe. Still no seat belt. Super churlish. 12/10 the dogs are killing it today,12,10,Daisy,
675354435921575936,None,None,2015-12-11 16:40:19+00:00,Twitter Web Client,Everyone needs to watch this. 13/10,13,10,None,
6.75349384339542e+17,https://pbs.twimg.com/media/CV9SrABU4AQI46z.jpg,borzoi,2015-12-11 16:20:15+00:00,Twitter for iPhone,Yea I lied. Here's more. All 13/10,13,10,None,
6.753340601563013e+17,https://pbs.twimg.com/media/CV9EvZNUwAAgLCK.jpg,Pembroke,2015-12-11 15:19:21+00:00,Twitter for iPhone,Good morning here's a grass pupper. 12/10,12,10,None,pupper
675166823650848770,None,None,2015-12-11 04:14:49+00:00,Twitter for iPhone,This is Arnold. He broke his leg saving a handicapped child from a forest fire. True hero. 10/10 inspirational dog,10,10,Arnold,
675153376133427200,None,None,2015-12-11 03:21:23+00:00,Twitter for iPhone,What kind of person sends in a picture without a dog in it? 1/10 just because that's a nice table,1,10,None,
6.751494091020124e+17,https://pbs.twimg.com/media/CV6czeEWEAEdChp.jpg,chow,2015-12-11 03:05:37+00:00,Twitter for iPhone,holy shit 12/10,12,10,None,
6.751471058083062e+17,https://pbs.twimg.com/media/CV6atgoWcAEsdv6.jpg,golden retriever,2015-12-11 02:56:28+00:00,Twitter for iPhone,When you're presenting a group project and the 4th guy tells the teacher that he did all the work. 10/10,10,10,None,
675146535592706048,None,None,2015-12-11 02:54:12+00:00,Twitter for iPhone,This is Coops. He's yelling at the carpet. Not very productive Coops. 7/10,7,10,Coops,
6.751454769545667e+17,https://pbs.twimg.com/media/CV6ZOPqWsAA20Uj.jpg,Labrador retriever,2015-12-11 02:49:59+00:00,Twitter for iPhone,What an honor. 3 dogs here. Blond one is clearly a gymnast. Other two just confused. Very nifty pups. 9/10 for all,9,10,None,
675135153782571009,None,None,2015-12-11 02:08:58+00:00,Twitter for iPhone,This is Steven. He got locked outside. Damn it Steven. 5/10 nice grill tho,5,10,Steven,
675113801096802304,None,None,2015-12-11 00:44:07+00:00,Twitter for iPhone,Meet Zuzu. He just graduated college. Astute pupper. Needs 2 leashes to contain him. Wasn't ready for the pic. 10/10,10,10,Zuzu,pupper
6.751116880945275e+17,https://pbs.twimg.com/media/CV56f54WsAEv4kJ.jpg,Labrador retriever,2015-12-11 00:35:44+00:00,Twitter for iPhone,Say hello to Oliver. He thought what was inside the pillow should be outside the pillow. Blurry since birth. 8/10,8,10,Oliver,
6.751092924758303e+17,https://pbs.twimg.com/media/CV54UQTXAAAGf-j.jpg,dalmatian,2015-12-11 00:26:12+00:00,Twitter for iPhone,C'mon guys. We've been over this. We only rate dogs. This is a cow. Please only submit dogs. Thank you...... 9/10,9,10,a,
6.750472986746634e+17,https://pbs.twimg.com/media/CV4_8FgXAAQOj4S.jpg,Samoyed,2015-12-10 20:19:52+00:00,Twitter for iPhone,This is a fluffy albino Bacardi Columbia mix. Excellent at the tweets. 11/10 would hug gently,11,10,a,
675015141583413248,None,None,2015-12-10 18:12:05+00:00,Twitter for iPhone,Meet Moe. He's a golden Fetty Woof. Doesn't respect the authorities. Might own a motorhome? 10/10 revolutionary pup,10,10,Moe,
6.750063122882683e+17,https://pbs.twimg.com/media/CV4aqCwWsAIi3OP.jpg,boxer,2015-12-10 17:37:00+00:00,Twitter for iPhone,Say hello to Mollie. This pic was taken after she bet all her toys on Ronda Rousey. 10/10 hang in there pupper,10,10,Mollie,pupper
6.750031285682913e+17,https://pbs.twimg.com/media/CV4XwYiWoAAHQIF.jpg,Pembroke,2015-12-10 17:24:21+00:00,Twitter for iPhone,Meet Laela. She's adorable. Magnificent eyes. But I don't see a seat belt. Insubordinate.. and churlish. Still 12/10,12,10,Laela,
6.749998076819087e+17,https://pbs.twimg.com/media/CV4UvgNUkAEEnZd.jpg,Rottweiler,2015-12-10 17:11:09+00:00,Twitter for iPhone,Ok last one of these. I may try to make some myself. Anyway here ya go. 13/10,13,10,None,
6.748054134985277e+17,https://pbs.twimg.com/ext_tw_video_thumb/674805331965399040/pu/img/-7bw8niVrgIkLKOW.jpg,English springer,2015-12-10 04:18:42+00:00,Twitter for iPhone,When your entire life is crumbling before you and you're trying really hard to hold your shit together. 10/10,10,10,None,
6.748005202221548e+17,https://pbs.twimg.com/media/CV1ffl3XAAAiFyr.jpg,Pembroke,2015-12-10 03:59:15+00:00,Twitter for iPhone,This is Tedders. He broke his leg saving babies from the Pompeii eruption. 11/10 where's his Purple Heart? @POTUS,11,10,Tedders,
6.747933991411466e+17,https://pbs.twimg.com/media/CV1ZA3oWEAA1HW_.jpg,giant schnauzer,2015-12-10 03:30:58+00:00,Twitter for iPhone,I have found another. 13/10,13,10,None,
6.747904881851679e+17,https://pbs.twimg.com/media/CV1WXsmWcAAgQ56.jpg,Labrador retriever,2015-12-10 03:19:24+00:00,Twitter for iPhone,ER... MER... GERD 13/10,13,10,None,
6.74788554665513e+17,https://pbs.twimg.com/media/CV1Um8vWIAAmhQn.jpg,miniature poodle,2015-12-10 03:11:43+00:00,Twitter for iPhone,Say hello to Maggie. She's a Western Septic Downy. Pretends to be Mexican. Great hardwood flooring. 9/10,9,10,Maggie,
674781762103414784,None,None,2015-12-10 02:44:43+00:00,Twitter for iPhone,Bedazzled pup here. Fashionable af. Super yellow. Looks hella fluffy. Webbed paws for efficient fetching. 8/10,8,10,None,
6.747744817563771e+17,https://pbs.twimg.com/media/CV1HztsWoAAuZwo.jpg,Chihuahua,2015-12-10 02:15:47+00:00,Twitter for iPhone,This is Superpup. His head isn't proportional to his body. Has yet to serve any justice. 11/10 maybe one day pupper,11,10,Superpup,pupper
674767892831932416,None,None,2015-12-10 01:49:36+00:00,Twitter for iPhone,This pup was carefully tossed to make it look like she's riding that horse. I have no words this is fabulous. 12/10,12,10,None,
6.747648173879009e+17,https://pbs.twimg.com/media/CV0_BSuWIAIvE9k.jpg,Samoyed,2015-12-10 01:37:23+00:00,Twitter for iPhone,These two pups are masters of camouflage. Very dedicated to the craft. Both must've spent decades practicing. 10/10s,10,10,None,
674754018082705410,None,None,2015-12-10 00:54:28+00:00,Twitter for iPhone,Just received another perfect photo of dogs and the sunset. 12/10,12,10,None,
