tweet_id,jpg_url,Dog_breed,timestamp,source,text,rating_numerator,rating_denominator,name,stage
7.189392419511951e+17,https://pbs.twimg.com/media/CfovbK4WIAAkTn3.jpg,Pembroke,2016-04-09 23:10:47+00:00,Twitter for iPhone,This is Otis. Everybody look at Otis. 12/10 would probably faint while petting,12,10,Otis,
7.18631497683583e+17,https://pbs.twimg.com/media/CfkXiX6W4AAmICF.jpg,Pomeranian,2016-04-09 02:47:55+00:00,Twitter for iPhone,We normally don't rate marshmallows but this one appears to be flawlessly toasted so I'll make an exception. 10/10,10,10,None,
7.186133057833984e+17,https://pbs.twimg.com/media/CfkG_PMWsAAH0MZ.jpg,Labrador retriever,2016-04-09 01:35:37+00:00,Twitter for iPhone,This is Carper. He's a Tortellini Angiosperm. In desperate need of a petting. 11/10 would hug softly,11,10,Carper,
7.185406306837094e+17,https://pbs.twimg.com/media/CfjE5FRXEAErFWR.jpg,Maltese dog,2016-04-08 20:46:50+00:00,Twitter for iPhone,Get you a pup that can do both. 10/10,10,10,None,
718460005985447936,None,None,2016-04-08 15:26:28+00:00,Twitter for iPhone,Meet Bowie. He's listening for underground squirrels. Smart af. Left eye is considerably magical. 9/10 would so pet,9,10,Bowie,
718454725339934721,None,None,2016-04-08 15:05:29+00:00,Twitter for iPhone,"This pic is old but I hadn't seen it until today and had to share. Creative af. 13/10 very good boy, would pet well",13,10,None,
7.182468869986877e+17,https://pbs.twimg.com/media/Cfe5tLWXEAIaoFO.jpg,Chihuahua,2016-04-08 01:19:36+00:00,Twitter for iPhone,This is Alexanderson. He's got a weird ass birth mark. Dreadful at fetch. Won't eat kibble. 3/10 wtf @Target,3,10,Alexanderson,
7.182346181226619e+17,https://pbs.twimg.com/media/CfeukpmW4AEGjOE.jpg,malamute,2016-04-08 00:30:51+00:00,Twitter for iPhone,This is Suki. She was born with a blurry tail (unfortunate). Next level tongue tho. 11/10 nifty hardwood,11,10,Suki,
7.178418011309793e+17,https://pbs.twimg.com/media/CfZJTphWAAAl5Ys.jpg,Brittany spaniel,2016-04-06 22:29:56+00:00,Twitter for iPhone,This is Barclay. His father was a banana. 11/10 appeeling af,11,10,Barclay,
717790033953034240,None,None,2016-04-06 19:04:14+00:00,Twitter for iPhone,"Here's a badass mystery pupper. You weren't aware that you owe him money, but you do. 10/10 shades sick af",10,10,None,pupper
7.175376872390083e+17,https://pbs.twimg.com/media/CfU0t75W4AAUo9V.jpg,golden retriever,2016-04-06 02:21:30+00:00,Twitter for iPhone,People please. This is a Deadly Mediterranean Plop T-Rex. We only rate dogs. Only send in dogs. Thanks you... 11/10,11,10,a,
717428917016076293,None,None,2016-04-05 19:09:17+00:00,Vine - Make a Scene,This is Skittle. He's trying to communicate. 11/10 solid effort,11,10,Skittle,
7.174218049907016e+17,https://pbs.twimg.com/media/CfTLUYWXEAEkyES.jpg,miniature pinscher,2016-04-05 18:41:02+00:00,Twitter for iPhone,This is Ebby. She's a Zimbabwean Feta. Embarrassed by ridiculously squishy face. 9/10 would squeeze softly,9,10,Ebby,
7.170474599822131e+17,https://pbs.twimg.com/media/CfN23ArXEAEkZkz.jpg,golden retriever,2016-04-04 17:53:31+00:00,Twitter for iPhone,This is FlÃ¡vio (pronounced Baxter). He's a Benesnoop Cumberdog. Super rare. Symmetrical. 12/10 would pet so well,12,10,FlÃ¡vio,
7.170093624520909e+17,https://pbs.twimg.com/media/CfNUNetW8AAekHx.jpg,Siberian husky,2016-04-04 15:22:08+00:00,Twitter for iPhone,This is Smokey. He's having some sort of existential crisis. 10/10 hang in there pupper,10,10,Smokey,pupper
7.16802964044845e+17,https://pbs.twimg.com/media/CfKYfeBXIAAopp2.jpg,malinois,2016-04-04 01:41:58+00:00,Twitter for iPhone,This is Link. He struggles with couches. 10/10 would assist,10,10,Link,
7.167911465891103e+17,https://pbs.twimg.com/media/CfKNvU8WsAAvI9Z.jpg,Pomeranian,2016-04-04 00:55:01+00:00,Twitter for iPhone,Meet Jennifur. She's supposed to be navigating. Not even buckled up. Insubordinate & churlish. 11/10 would still pet,11,10,Jennifur,
716730379797970944,None,None,2016-04-03 20:53:33+00:00,Twitter for iPhone,There has clearly been a mistake. Pup did nothing wrong. 12/10 would help escape,12,10,None,
716447146686459905,None,None,2016-04-03 02:08:05+00:00,Vine - Make a Scene,This is Ozzy. He's acrobatic af. Legendary pupper status achieved. 13/10,13,10,Ozzy,pupper
7.164391181846528e+17,https://pbs.twimg.com/media/CfFNk7cWAAA-hND.jpg,Siberian husky,2016-04-03 01:36:11+00:00,Twitter for iPhone,This is Bluebert. He just saw that both #FinalFur match ups are split 50/50. Amazed af. 11/10,10,10,Bluebert,
7.162855078655427e+17,https://pbs.twimg.com/media/CfDB3aJXEAAEZNv.jpg,Yorkshire terrier,2016-04-02 15:25:47+00:00,Twitter for iPhone,This is Stephanus. She stays woke. 12/10,12,10,Stephanus,
7.160808698873815e+17,https://pbs.twimg.com/media/CfAHv83UMAIEQYx.jpg,golden retriever,2016-04-02 01:52:38+00:00,Twitter for iPhone,Here's a super majestic doggo and a sunset 11/10,11,10,None,doggo
7.159284231060275e+17,https://pbs.twimg.com/media/Ce99GhLW8AAHG38.jpg,pug,2016-04-01 15:46:52+00:00,Twitter for iPhone,This is Bubbles. He's a Yorkshire Piccolope. 11/10 would snug aggressively,11,10,Bubbles,
715758151270801409,None,None,2016-04-01 04:30:16+00:00,Vine - Make a Scene,This is old now but it's absolutely heckin fantastic and I can't not share it with you all. 13/10,13,10,old,
7.157332652237087e+17,https://pbs.twimg.com/media/Ce7LlUeUUAEQkQl.jpg,Dandie Dinmont,2016-04-01 02:51:22+00:00,Twitter for iPhone,This is a taco. We only rate dogs. Please only send in dogs. Dogs are what we rate. Not tacos. Thank you... 10/10,10,10,a,
715704790270025728,None,None,2016-04-01 00:58:13+00:00,Vine - Make a Scene,This is Bentley. He gives kisses back. 11/10 precious af (vid by @emmaallen25),11,10,Bentley,
7.156967432377303e+17,https://pbs.twimg.com/media/Ce6qZC2WAAAcSoI.jpg,Staffordshire bullterrier,2016-04-01 00:26:15+00:00,Twitter for iPhone,Meet Toby. He's a Lithuanian High-Steppin Stickeroo. One of the more accomplished Stickeroos around. 10/10 so nifty,10,10,Toby,
7.156807958269829e+17,https://pbs.twimg.com/media/Ce6b4MPWwAA22Xm.jpg,golden retriever,2016-03-31 23:22:53+00:00,Twitter for iPhone,This is Zeus. He's downright fabulous. 12/10,12,10,Zeus,
715360349751484417,None,None,2016-03-31 02:09:32+00:00,Twitter for iPhone,This is Bertson. He just wants to say hi. 11/10 would boop nose,11,10,Bertson,
7.153424663087841e+17,https://pbs.twimg.com/media/Ce1oLNqWAAE34w7.jpg,West Highland white terrier,2016-03-31 00:58:29+00:00,Twitter for iPhone,This is Oscar. He's a world renowned snowball inspector. It's a ruff job but someone has to do it. 10/10 great guy,10,10,Oscar,
7.152201935769272e+17,https://pbs.twimg.com/media/Cez49UqWsAIRQXc.jpg,Chihuahua,2016-03-30 16:52:36+00:00,Twitter for iPhone,This is Nico. His selfie game is strong af. Excellent use of a sneaky tongue slip. 10/10 star material,10,10,Nico,
7.152006247538196e+17,https://pbs.twimg.com/media/CeznK6IWEAEFUPq.jpg,Chihuahua,2016-03-30 15:34:51+00:00,Twitter for iPhone,This is Michelangelope. He's half coffee cup. Rare af. 12/10 would hug until someone stopped me,12,10,Michelangelope,
715009755312439296,None,None,2016-03-30 02:56:24+00:00,Twitter for iPhone,This is Siba. She's remarkably mobile. Very sleepy as well. 12/10 would happily transport,12,10,Siba,
7.149823003631739e+17,https://pbs.twimg.com/media/CewgnHAXEAAdbld.jpg,Brittany spaniel,2016-03-30 01:07:18+00:00,Twitter for iPhone,This is Calbert. He forgot to clear his Google search history. 9/10 rookie mistake Calbert,9,10,Calbert,
714962719905021952,None,None,2016-03-29 23:49:30+00:00,Vine - Make a Scene,Just in case anyone's having a bad day. 12/10 would bounce with,12,10,None,
7.149576200173076e+17,https://pbs.twimg.com/media/CewKKiOWwAIe3pR.jpg,Great Pyrenees,2016-03-29 23:29:14+00:00,Twitter for iPhone,This is Curtis. He's an Albino Haberdasher. Terrified of dandelions. They really spook him up. 10/10 it'll be ok pup,10,10,Curtis,
714631576617938945,None,None,2016-03-29 01:53:39+00:00,Twitter for iPhone,This is Benedict. He's a feisty pup. Needs a brushing. Portable af. Looks very angry actually. 4/10 might not pet,4,10,Benedict,
7.146060139749745e+17,https://pbs.twimg.com/media/CerKYG8WAAM1aE-.jpg,Norfolk terrier,2016-03-29 00:12:05+00:00,Twitter for iPhone,Here are two lil cuddly puppers. Both 12/10 would snug like so much,12,10,None,
714485234495041536,None,None,2016-03-28 16:12:09+00:00,Vine - Make a Scene,This is Blitz. He screams. 10/10 (vid by @yeaahliv),10,10,Blitz,
7.142582587903877e+17,https://pbs.twimg.com/media/CemOGNjWQAEoN7R.jpg,collie,2016-03-28 01:10:13+00:00,Twitter for iPhone,Meet Travis and Flurp. Travis is pretty chill but Flurp can't lie down properly. 10/10 & 8/10 get it together Flurp,10,10,Travis,
7.142515866761134e+17,https://pbs.twimg.com/media/CemIBt4WwAQqhVV.jpg,soft-coated wheaten terrier,2016-03-28 00:43:43+00:00,Twitter for iPhone,This is Thumas. He hates potted plants. 8/10 wtf Thumas,8,10,Thumas,
7.14214115368108e+17,https://pbs.twimg.com/media/Cell8ikWIAACCJ-.jpg,pug,2016-03-27 22:14:49+00:00,Twitter for iPhone,Happy Easter from the squad! ðŸ‡ðŸ¶ 13/10 for all,13,10,None,
7.141414084630364e+17,https://pbs.twimg.com/media/Cekj0qwXEAAHcS6.jpg,Labrador retriever,2016-03-27 17:25:54+00:00,Twitter for iPhone,"I know we only rate dogs, but since it's Easter I guess we could rate a bunny for a change. 10/10 petable as hell",10,10,None,
7.139194622447903e+17,https://pbs.twimg.com/media/CehZ9mLWsAAsn28.jpg,Siberian husky,2016-03-27 02:43:58+00:00,Twitter for iPhone,This is Kanu. He's a Freckled Ticonderoga. Simply flawless. 12/10 would perform an elaborate heist to capture,12,10,Kanu,
713909862279876608,None,None,2016-03-27 02:05:49+00:00,Vine - Make a Scene,This is Doug. His nose is legendary af. 12/10 (vid by @probably_trey),12,10,Doug,
7.139006034376212e+17,https://pbs.twimg.com/media/CehIzzZWQAEyHH5.jpg,golden retriever,2016-03-27 01:29:02+00:00,Twitter for iPhone,Happy Saturday here's 9 puppers on a bench. 99/90 good work everybody,10,10,None,
7.137611977204736e+17,https://pbs.twimg.com/media/CefKBOuWIAAIlKD.jpg,Brittany spaniel,2016-03-26 16:15:05+00:00,Twitter for iPhone,This is Piper. She would really like that tennis ball core. Super sneaky tongue slip. 12/10 precious af,12,10,Piper,
7.134110742262743e+17,https://pbs.twimg.com/media/CeaLlAPUMAIcC7U.jpg,Great Pyrenees,2016-03-25 17:03:49+00:00,Twitter for iPhone,Here we see an extremely rare Bearded Floofmallow. Only a few left in the wild. 11/10 would pet with a purpose,11,10,None,
7.131775434871357e+17,https://pbs.twimg.com/media/CeW3MWMWQAEOMbq.jpg,whippet,2016-03-25 01:35:51+00:00,Twitter for iPhone,This is Lance. Lance doesn't give a shit. 10/10 we should all be more like Lance,10,10,Lance,
713175907180089344,None,None,2016-03-25 01:29:21+00:00,Twitter for iPhone,Say hello to Opie and Clarkus. Clarkus fell asleep so Opie buried him. Ruthless af 10/10 for both,10,10,Opie,
7.128090259859784e+17,https://pbs.twimg.com/media/CeRoBaxWEAABi0X.jpg,Labrador retriever,2016-03-24 01:11:29+00:00,Twitter for iPhone,This is Stubert. He just arrived. 10/10,10,10,Stubert,
7.12717840512598e+17,https://pbs.twimg.com/media/CeQVF1eVIAAJaTv.jpg,Great Pyrenees,2016-03-23 19:09:09+00:00,Twitter for iPhone,Please don't send in any more polar bears. We only rate dogs. Thank you... 10/10,10,10,None,
7.126686548533371e+17,https://pbs.twimg.com/media/CePoVTyWsAQEz1g.jpg,Labrador retriever,2016-03-23 15:53:42+00:00,Twitter for iPhone,Say hello to Sunny and Roxy. They pull things out of water together. 10/10 for both,10,10,Sunny,
712438159032893441,None,None,2016-03-23 00:37:48+00:00,Twitter for iPhone,This is Kane. He's a semi-submerged Haitian Huffleplop. Happy af. Sick waterfall. 11/10 would pat head approvingly,11,10,Kane,
712309440758808576,None,None,2016-03-22 16:06:19+00:00,Twitter for iPhone,"Reminder that we made our first set of stickers available! All are 12/10 would stick Use code ""pupper"" at checkoutðŸ¶",12,10,None,pupper
7.120974307502899e+17,https://pbs.twimg.com/media/CeHg1klW8AE4YOB.jpg,Labrador retriever,2016-03-22 02:03:52+00:00,Twitter for iPhone,I can't even comprehend how confused this dog must be right now. 10/10,10,10,None,
712092745624633345,None,None,2016-03-22 01:45:15+00:00,Twitter for iPhone,This is Steven. He's inverted af. Also very helpful. Scans anything you want for free. Takes him a while tho. 7/10,7,10,Steven,
7.120856173882122e+17,https://pbs.twimg.com/media/CeHWFksXIAAyypp.jpg,Shih-Tzu,2016-03-22 01:16:55+00:00,Twitter for iPhone,Say hello to Olive and Ruby. They are best buddies. Both 11/10  1 like = 1 buddy,11,10,Olive,
712065007010385924,None,None,2016-03-21 23:55:01+00:00,Twitter for iPhone,This is Chester. He's clearly in charge of the other dogs. Weird ass paws. Not fit for fetch. 6/10 would still pet,6,10,Chester,
711968124745228288,None,None,2016-03-21 17:30:03+00:00,Twitter for iPhone,Meet Winston. He's trapped in a cup of coffee. Poor pupper. 10/10 someone free him,10,10,Winston,pupper
7.117437781645148e+17,https://pbs.twimg.com/media/CeCfMPDW0AAAEUj.jpg,Lakeland terrier,2016-03-21 02:38:34+00:00,Twitter for iPhone,Meet Roosevelt. He's calculating the best case scenario if he drops out instead of doing math hw. 11/10 relatable af,11,10,Roosevelt,
711732680602345472,None,None,2016-03-21 01:54:29+00:00,Twitter for iPhone,I want to hear the joke this dog was just told. 10/10,10,10,None,
711694788429553666,None,None,2016-03-20 23:23:54+00:00,Twitter for iPhone,Oh. My. God. 13/10 magical af,13,10,None,
711652651650457602,None,None,2016-03-20 20:36:28+00:00,Twitter for iPhone,This is Gary. He just wanted to say hi. 9/10 very personable pup,9,10,Gary,
7.113638259797565e+17,https://pbs.twimg.com/media/Cd9Fn5QUMAAYMT4.jpg,Pembroke,2016-03-20 01:28:47+00:00,Twitter for iPhone,"""Please, no puparazzi"" 11/10",11,10,None,
711306686208872448,None,None,2016-03-19 21:41:44+00:00,Twitter for iPhone,What hooligan sent in pictures w/out a dog in them? Churlish af. 3/10 just bc that's a neat fluffy bean bag chair,3,10,None,
7.11008018775851e+17,https://pbs.twimg.com/media/Cd4CBQFW8AAY3ND.jpg,French bulldog,2016-03-19 01:54:56+00:00,Twitter for iPhone,This is Chuckles. He had a balloon but he accidentally let go of it and it floated away. 11/10 hang in there pupper,11,10,Chuckles,pupper
7.10997087345877e+17,https://pbs.twimg.com/media/Cd34FClUMAAnvGP.jpg,malamute,2016-03-19 01:11:29+00:00,Twitter for iPhone,Meet Milo and Amos. They are the best of pals. Both 12/10 would pet at the same time,12,10,Milo,
710844581445812225,None,None,2016-03-18 15:05:29+00:00,Twitter for iPhone,This is Staniel. His selfie game is strong af. 10/10 I'd snapchat with Staniel,10,10,Staniel,
7.108331178928988e+17,https://pbs.twimg.com/media/Cd1i8qvUkAE-Jlr.jpg,Pembroke,2016-03-18 14:19:56+00:00,Twitter for iPhone,Say hello to Sora. She's an Egyptian Pumpernickel. Mesmerizing af. 12/10 would bring home to mom,12,10,Sora,
7.106586908865864e+17,https://pbs.twimg.com/media/CdzETn4W4AAVU5N.jpg,soft-coated wheaten terrier,2016-03-18 02:46:49+00:00,Twitter for iPhone,Here's a brigade of puppers. All look very prepared for whatever happens next. 80/80,10,10,None,
710609963652087808,None,None,2016-03-17 23:33:12+00:00,Vine - Make a Scene,I've watched this a million times and you probably will too. 12/10 (vid by @emily_galasso),12,10,None,
7.105889346869084e+17,https://pbs.twimg.com/media/CdyE2x1W8AAe0TG.jpg,Pembroke,2016-03-17 22:09:38+00:00,Twitter for iPhone,This is Beemo. He's a Chubberflop mix. 12/10 would cross the world for,12,10,Beemo,
710296729921429505,None,None,2016-03-17 02:48:31+00:00,Vine - Make a Scene,This is Oshie. 12/10 please enjoy (vid by @catherinec1389),12,10,Oshie,
7.102832701061325e+17,https://pbs.twimg.com/media/Cdtu3WRUkAAsRVx.jpg,Shih-Tzu,2016-03-17 01:55:02+00:00,Twitter for iPhone,This is Gunner. He's a Figamus Newton. King of the peek-a-boo. Cool jeans. 11/10,11,10,Gunner,
7.102722978447974e+17,https://pbs.twimg.com/media/Cdtk414WoAIUG0v.jpg,Old English sheepdog,2016-03-17 01:11:26+00:00,Twitter for iPhone,We ðŸ‘ðŸ» only ðŸ‘ðŸ» rate ðŸ‘ðŸ» dogs. Pls stop sending in non-canines like this Dutch Panda Worm. This is infuriating. 11/10,11,10,infuriating,
7.102691096997396e+17,https://pbs.twimg.com/media/Cdth_KyWEAEXH3u.jpg,pug,2016-03-17 00:58:46+00:00,Twitter for iPhone,The squad is back for St. Patrick's Day! â˜˜ ðŸ’š 13/10 for all,13,10,None,
710153181850935296,None,None,2016-03-16 17:18:07+00:00,Twitter for iPhone,This is Lacy. She's tipping her hat to you. Daydreams of her life back on the frontier. 11/10 would pet so well,11,10,Lacy,
7.101409712840376e+17,https://pbs.twimg.com/media/Cdrtcr-W4AAqi5H.jpg,Pekinese,2016-03-16 16:29:35+00:00,Twitter for iPhone,This is Tater. His underbite is fierce af. Doesn't give a damn about your engagement photo. 8/10,8,10,Tater,
7.101170146569503e+17,https://pbs.twimg.com/media/CdrXp9dWoAAcRfn.jpg,toy poodle,2016-03-16 14:54:24+00:00,Twitter for iPhone,This pupper got her hair chalked for her birthday. Hasn't told her parents yet. Rebellious af. 11/10 very nifty,11,10,None,pupper
7.099187988837745e+17,https://pbs.twimg.com/media/CdojYQmW8AApv4h.jpg,Pembroke,2016-03-16 01:46:45+00:00,Twitter for iPhone,Meet Watson. He's a Suzuki Tickleboop. Leader of a notorious biker gang. Only one ear functional. 12/10 snuggable af,12,10,Watson,
709901256215666688,None,None,2016-03-16 00:37:03+00:00,Twitter for iPhone,"WeRateDogs stickers are here and they're 12/10! Use code ""puppers"" at checkout ðŸ¶ðŸ¾  Shop now:",12,10,None,
7.098528473876275e+17,https://pbs.twimg.com/media/CdnnZhhWAAEAoUc.jpg,Chihuahua,2016-03-15 21:24:41+00:00,Twitter for iPhone,*lets out a tiny whimper and then collapses* ...12/10,12,10,None,
7.09566166965076e+17,https://pbs.twimg.com/media/Cdjiqi6XIAIUOg-.jpg,chow,2016-03-15 02:25:31+00:00,Twitter for iPhone,This is Olaf. He's gotta be rare. Seems sturdy. Tail is floofy af. 12/10 would do whatever it takes to pet,12,10,Olaf,
7.095569548977644e+17,https://pbs.twimg.com/media/CdjaSFCWAAAJZh3.jpg,golden retriever,2016-03-15 01:48:55+00:00,Twitter for iPhone,This is Cecil. She's a Gigglefloof Poofer. Outdoorsy af. One with nature. 12/10 would strategically capture,12,10,Cecil,
7.095192405760369e+17,https://pbs.twimg.com/media/Cdi3-f7W8AUOm9T.jpg,cocker spaniel,2016-03-14 23:19:03+00:00,Twitter for iPhone,This is Vince. He's a Gregorian Flapjeck. White spot on legs almost looks like another dog (whoa). 9/10 rad as hell,9,10,Vince,
7.094496004159611e+17,https://pbs.twimg.com/media/Cdh4pgAW0AEKJ_a.jpg,Maltese dog,2016-03-14 18:42:20+00:00,Twitter for iPhone,Meet Karma. She's just a head. Lost body during the Second Punic War (unfortunate). Loves to travel 10/10 petable af,10,10,Karma,
7.094094581333238e+17,https://pbs.twimg.com/media/CdhUIMSUIAA4wYK.jpg,Shetland sheepdog,2016-03-14 16:02:49+00:00,Twitter for iPhone,This is Billy. He sensed a squirrel. 8/10 damn it Billy,8,10,Billy,
7.09225125749588e+17,https://pbs.twimg.com/media/Cdese-zWEAArIqE.jpg,Labrador retriever,2016-03-14 03:50:21+00:00,Twitter for iPhone,This is Walker. He's a Butternut Khalifa. Appears fuzzy af. 11/10 would hug for a ridiculous amount of time,11,10,Walker,
7.092073478398362e+17,https://pbs.twimg.com/media/CdecUSzUIAAHCvg.jpg,Chihuahua,2016-03-14 02:39:42+00:00,Twitter for iPhone,This is Penny. She's trying on her prom dress. Stunning af 11/10,11,10,Penny,
7.091983956430684e+17,https://pbs.twimg.com/media/CdeUKpcWoAAJAWJ.jpg,borzoi,2016-03-14 02:04:08+00:00,Twitter for iPhone,"From left to right: Cletus, Jerome, Alejandro, Burp, & Titson None know where camera is. 45/50 would hug all at once",10,10,None,
709179584944730112,None,None,2016-03-14 00:49:23+00:00,Vine - Make a Scene,This is Sammy. He's in a tree. Very excited about it. 13/10,13,10,Sammy,
7.09158332880298e+17,https://pbs.twimg.com/media/CddvvSwWoAUObQw.jpg,Siberian husky,2016-03-13 23:24:56+00:00,Twitter for iPhone,Meet Rodney. He's a Ukranian Boomchicka. Outside but would like to be inside. Only has one ear (unfortunate) 10/10,10,10,Rodney,
709042156699303936,None,None,2016-03-13 15:43:18+00:00,Twitter for iPhone,This is Klevin. He's addicted to sandwiches (yes a hotdog is a sandwich fight me) It's tearing his family apart 9/10,9,10,Klevin,
708853462201716736,None,None,2016-03-13 03:13:29+00:00,Vine - Make a Scene,This is Lucy. She doesn't understand fetch. 8/10 try turning off and back on (vid by @rileyyoungblood),8,10,Lucy,
7.088458219413873e+17,https://pbs.twimg.com/media/CdZTgynWwAATZcx.jpg,schipperke,2016-03-13 02:43:08+00:00,Twitter for iPhone,Here's a pupper with magic eyes. Not wearing a seat belt tho (irresponsible af). Very distracting to driver. 9/10,9,10,None,pupper
7.088343167138939e+17,https://pbs.twimg.com/media/CdZI_bpWEAAm1fs.jpg,Eskimo dog,2016-03-13 01:57:25+00:00,Twitter for iPhone,Meet Malikai. He was rolling around having fun when he remembered the inevitable heat death of the universe. 10/10,10,10,Malikai,
7.088109159788544e+17,https://pbs.twimg.com/media/CdYzwuYUIAAHPkB.jpg,golden retriever,2016-03-13 00:24:26+00:00,Twitter for iPhone,This is Mister. He's a wonderful father to his two pups. Heartwarming af. 10/10 for all,10,10,Mister,
7.087381436384502e+17,https://pbs.twimg.com/media/CdXxlFPWwAABaOv.jpg,Pomeranian,2016-03-12 19:35:15+00:00,Twitter for iPhone,This is Coco. She gets to stay on the Bachelor for another week. Super pumped 11/10,11,10,Coco,
708711088997666817,None,None,2016-03-12 17:47:45+00:00,Twitter for iPhone,This is Smokey. He really likes tennis balls. 11/10,11,10,Smokey,
7.084796500880343e+17,https://pbs.twimg.com/media/CdUGcLMWAAI42q0.jpg,Shih-Tzu,2016-03-12 02:28:06+00:00,Twitter for iPhone,Meet Bear. He's a Beneboop Cumberclap. Extremely unamused. 13/10 I'm in love with this picture,13,10,Bear,
7.084699155152978e+17,https://pbs.twimg.com/media/CdT9n7mW0AQcpZU.jpg,Chihuahua,2016-03-12 01:49:25+00:00,Twitter for iPhone,This is Bobble. He's a Croatian Galifianakis. Hears everything within 400 miles. 11/10 would snug diligently,11,10,Bobble,
708400866336894977,None,None,2016-03-11 21:15:02+00:00,Vine - Make a Scene,RT if you are as ready for summer as this pup is 12/10,12,10,None,
7.083564630482043e+17,https://pbs.twimg.com/media/CdSWcc1XIAAXc6H.jpg,pug,2016-03-11 18:18:36+00:00,Twitter for iPhone,This is Oliver. That is his castle. He protects it with his life. He's also squishy af. 10/10 would squish softly,10,10,Oliver,
708349470027751425,None,None,2016-03-11 17:50:48+00:00,Twitter for iPhone,This is River. He's changing the trumpet game. Innovative af. 11/10 such a good boy,11,10,River,
7.081493632567747e+17,https://pbs.twimg.com/media/CdPaEkHW8AA-Wom.jpg,Cardigan,2016-03-11 04:35:39+00:00,Twitter for iPhone,This is Jebberson. He's the reigning hide and seek world champion. 10/10 hasn't lost his touch,10,10,Jebberson,
7.081309231417958e+17,https://pbs.twimg.com/media/CdPJUWIWIAAIchl.jpg,French bulldog,2016-03-11 03:22:23+00:00,Twitter for iPhone,Please stop sending in non canines like this Guatemalan Twiggle Bunny. We only rate dogs. Only send in dogs... 11/10,11,10,None,
7.081194893139517e+17,https://pbs.twimg.com/media/CdO-6x5W8AENSBJ.jpg,Norwich terrier,2016-03-11 02:36:57+00:00,Twitter for iPhone,This is Cooper. He basks in the glory of rebellion. 9/10 probably a preteen,9,10,Cooper,
7.08109389455102e+17,https://pbs.twimg.com/media/CdO1u9vWAAApj2V.jpg,Staffordshire bullterrier,2016-03-11 01:56:49+00:00,Twitter for iPhone,This is Remington. He was caught off guard by the magical floating cheese. Spooked af. 10/10 deep breaths pup,10,10,Remington,
7.080262487825859e+17,https://pbs.twimg.com/ext_tw_video_thumb/708026062568087553/pu/img/rNhylAwIfb6YthGu.jpg,malinois,2016-03-10 20:26:26+00:00,Twitter for iPhone,Everybody stop what you're doing and watch this video. Frank is stuck in a loop. 13/10 (Vid by @klbmatty),13,10,None,
707995814724026368,None,None,2016-03-10 18:25:30+00:00,Twitter for iPhone,This is Farfle. He lost his back legs during the Battle of Gettysburg. Goes 0-60 in 4.3 seconds (damn) 12/10 hero af,12,10,Farfle,
707983188426153984,None,None,2016-03-10 17:35:20+00:00,Twitter for iPhone,@serial @MrRoles OH MY GOD I listened to all of season 1 during a single road trip. I love you guys! I can confirm Bernie's 12/10 rating :),12,10,None,
7.07969809498153e+17,https://pbs.twimg.com/media/CdM2xRpXEAUsR4k.jpg,toy poodle,2016-03-10 16:42:10+00:00,Twitter for iPhone,Meet Rufus. He's a Honeysuckle Firefox. Curly af. Badass tie. About to go on his first date ever 11/10 good luck pup,11,10,Rufus,
7.077769350075392e+17,https://pbs.twimg.com/media/CdKHWimWoAABs08.jpg,miniature pinscher,2016-03-10 03:55:45+00:00,Twitter for iPhone,This is Sadie. She's a Bohemian Rhapsody. Remarkably portable. Could sneak on roller coasters with (probably). 11/10,11,10,Sadie,
7.077415174572605e+17,https://pbs.twimg.com/media/CdJnJ1dUEAARNcf.jpg,whippet,2016-03-10 01:35:01+00:00,Twitter for iPhone,When your roommate eats your leftover Chili's but you pretend it's no big deal cuz you fat anyway. 10/10 head up pup,10,10,None,
707738799544082433,None,None,2016-03-10 01:24:13+00:00,Vine - Make a Scene,He's doing his best. 12/10 very impressive that he got his license in the first place,12,10,None,
707693576495472641,None,None,2016-03-09 22:24:31+00:00,Twitter for iPhone,This is Jiminus. He's in a tub for some reason. What a jokester. Smh 7/10 churlish af,7,10,Jiminus,
707629649552134146,None,None,2016-03-09 18:10:30+00:00,Vine - Make a Scene,We usually don't rate marshmallows but this one's having so much fun in the snow. 10/10 (vid by @kylejk24),10,10,None,
7.076109487234785e+17,https://pbs.twimg.com/media/CdHwZd0VIAA4792.jpg,golden retriever,2016-03-09 16:56:11+00:00,Twitter for iPhone,This is Harper. She scraped her elbow attempting a backflip off a tree. Valiant effort tho. 12/10,12,10,Harper,
